{
  "schema_version": "1.0.0",
  "astrazit_recording_id": "AST-REC-000002",
  "astrazit_work_id": "AST-WRK-000002",
  "recording_title": "Fictional Midnight Drift",
  "version": "Extended Mix",
  "artist": "AstraZit",
  "catalog_origin": "NATIVE",
  "lifecycle_status": "RELEASED",
  "music": {
    "duration_seconds": 320.0,
    "bpm": 122.0,
    "key": "F#",
    "scale": "MINOR",
    "genre": "Synthwave",
    "moods": [
      "Nocturnal",
      "Driving"
    ],
    "energy": 0.75,
    "language": "en"
  },
  "master_rights": {
    "copyright_notice_sound_recording": "(P) 2026 AstraZit Music LLC",
    "isrc": "USXYZ2600002",
    "content_id": {
      "status": "ACTIVE_MONETIZE",
      "policy": "MONETIZE"
    },
    "owners": [
      {
        "name": "AstraZit Music LLC",
        "percentage": 100
      }
    ],
    "approval_status": "APPROVED",
    "approved_by": "fictional-master-rights-reviewer",
    "approved_at": "2026-09-08T12:00:00Z"
  },
  "provenance": {
    "source": "HUMAN_ENTERED",
    "source_system": "mastering_suite",
    "generated_at": "2026-09-08T11:00:00Z",
    "approval_status": "APPROVED",
    "approver": "fictional-audio-engineer",
    "approved_at": "2026-09-08T11:30:00Z",
    "version": 1,
    "canonical_status": "MASTER_METADATA",
    "notes": " Fictional fixture only: no real ownership, approvals, catalog allocations, or assets are asserted."
  }
}
